{"artifact_epoch":0,"build_receipt_id":"1b714d9499c15d9d8f41fc35a7e7f1ab69894fcbbf4598f5065a6fc05ed6b3a1","canonicalization":"rs-canonical-json-v1","computation_ms":99,"coverage_plan_digest":"ae7b382078ea015eacd434fdfe8737480025be38eb95eb221dd4561a4716d87b","entries":[{"component_digest_version":"validation-entry-components.v1","component_digests":{"arguments":"fac58592753e8c813f1f8536230ce946d873159235e83233bf57db6b28d26005","artifact_epoch":"5feceb66ffc86f38d952786c6d696c79c2dbc239dd4e91b46729d73a27fb57e9","build_artifact":"ff86ad5043e1a52a4dd61f6d93df874faaef6bb780a0bfd75520cf7105106b1f","capability":"9337f94d8f30665f3ba80c2f466bb6942bec2324ccf7e69df3bef7d2b2c7cd60","coverage":"16fe6f2bebd7371049b77024837d2971b7f026c3350a69d08877974b8d782fd1","environment":"8b7d00b0c7aac7907e16b1cf899542043d74cd6174b43e4740046627ab79b691","logical_input":"52ec9a309eaba7d3be6d2153aa0e987546d24c904db7ca8955c02de8ee53cc78","outcome_policy":"2e35f04f0ac921c2ef182cc59b5d7c26a0b8986b516af91cc5a72c65a5ae6a14","runner":"d1c7ce2c721582b79031bfb54411db782e90860e9c15c3443106c03863825f6f","shared_contract":"deb60c7c86dae3badae45cbebe72f916ef88f3ad61d077c6d2e6baeeb2e1e422","source_input":"cc85df3499303425b88b3a95ed58f37133e600b9271a3b1b5e2ae63b19abec92"},"computation_ms":70,"fingerprint":"eeec989af8e56f7efddba336e4c3fce0b37aab882e995644abfe91aa2e683168","id":"selftest.compare-directories"}],"fingerprints_digest":"11d330edd35c0b743df911466109bbd8bd7cc0038e91cb1c63c8de8a4562f0b1","plan_digest":"f714b362ec0344db54268c045d89800312aa469c3c70dab894ae302133dff582","schema":"red-salamander.validation-entry-fingerprints.v1","snapshot_id":"c5c9c1b344894b6944a1a074fdfcf31158109d10c9c50135236c90d23db55a67"}
