{"artifact_epoch":0,"build_receipt_id":"937f5c1c3c21135a6155889a02f572bd6cc3e70db49987fab55f2ac8905c74bc","canonicalization":"rs-canonical-json-v1","computation_ms":161,"coverage_plan_digest":"ff50dc89ead4c7e29ecdb5568d6f56762f754bd7b5f5993b60de17e167564007","entries":[{"component_digest_version":"validation-entry-components.v1","component_digests":{"arguments":"f75092254c276cd78e746a8132b2e9ed4e4a82abc60c62c4a7ab388c13e07460","artifact_epoch":"5feceb66ffc86f38d952786c6d696c79c2dbc239dd4e91b46729d73a27fb57e9","build_artifact":"fe5fd70e95509e30060e17964e3d84caa815dd051187351c64bed76c04513a3d","capability":"9337f94d8f30665f3ba80c2f466bb6942bec2324ccf7e69df3bef7d2b2c7cd60","coverage":"281c4879b16d86c68b84363a67bf3da39ba9649b7fef63596d20f26a0bd9d6f8","environment":"8b7d00b0c7aac7907e16b1cf899542043d74cd6174b43e4740046627ab79b691","logical_input":"df384408c2d89b7720adaa6e4ae2a18b08f78b6a366d02ca7aab98663f8442df","outcome_policy":"2e35f04f0ac921c2ef182cc59b5d7c26a0b8986b516af91cc5a72c65a5ae6a14","runner":"d1c7ce2c721582b79031bfb54411db782e90860e9c15c3443106c03863825f6f","shared_contract":"deb60c7c86dae3badae45cbebe72f916ef88f3ad61d077c6d2e6baeeb2e1e422","source_input":"e7d8ebcefd8dede3d14489a943cccc70ac67900a3a104a1601d9e620d169827e"},"computation_ms":124,"fingerprint":"6275837a233ac7bb3cf6adc257deee06d151f1f51f7b14f8621b1aa9cb83eb5d","id":"selftest.compare-directories"}],"fingerprints_digest":"0b54456266a2072c9b9616782581a1a9901ca1460f7548d856d38fa592c95358","plan_digest":"287da39dcb660862046f72d156f421f4659a098cc40ca89c3b09b190b2e888e1","schema":"red-salamander.validation-entry-fingerprints.v1","snapshot_id":"d7cb034027153c7799a7b61a1e70bbe131bc10b550ad4ec9e5d4007f0f18eaae"}
