{"artifact_epoch":0,"build_receipt_id":"a519c7a8b8ae63a1257adbbcccbd28d105002d3f9d4483ca0330d547cb6424f8","canonicalization":"rs-canonical-json-v1","computation_ms":93,"coverage_plan_digest":"ae5234f67989adf751bd5d8345da29381cf89275c7ce91022e56343913034b72","entries":[{"component_digest_version":"validation-entry-components.v1","component_digests":{"arguments":"a6b356d476957fdb44d863d962229507a9c4a6fcceb4090d18b0db74b4125ee5","artifact_epoch":"5feceb66ffc86f38d952786c6d696c79c2dbc239dd4e91b46729d73a27fb57e9","build_artifact":"539b71eee764bca9c776cf9ce0ecd2d0861aeafe8116f26a442557f230ff5d60","capability":"9337f94d8f30665f3ba80c2f466bb6942bec2324ccf7e69df3bef7d2b2c7cd60","coverage":"b41bfb93d35b230b6e07f7ecf971c928653ef4f50eb0bc30311f8da966a21814","environment":"8b7d00b0c7aac7907e16b1cf899542043d74cd6174b43e4740046627ab79b691","logical_input":"bc2b714bd5adab96296b4336b62b0fb744d7ddbe5fb69f5405c5c5f5cd463cd2","outcome_policy":"2e35f04f0ac921c2ef182cc59b5d7c26a0b8986b516af91cc5a72c65a5ae6a14","runner":"d1c7ce2c721582b79031bfb54411db782e90860e9c15c3443106c03863825f6f","shared_contract":"deb60c7c86dae3badae45cbebe72f916ef88f3ad61d077c6d2e6baeeb2e1e422","source_input":"9ff7afe9135745b12823afe045b07846c443a12f9368aee6527e8f4456c1f596"},"computation_ms":63,"fingerprint":"de143e58f7d53fe1b6d8c74c67dde7e59c76f572c3fac4c4942a4857c5688008","id":"selftest.compare-directories"}],"fingerprints_digest":"e43593a280cc31fbb4d8bc73f7b85f7f69631c7b2e6a375032b1813c54256868","plan_digest":"0448483b0ebe0ec2e4342a9560396e44a95326ecd762a2a4f49f9f00437d8115","schema":"red-salamander.validation-entry-fingerprints.v1","snapshot_id":"f915a122a1f7811e1f1805a8f3a88b60d7d07f5f1b6a87c72695712839d3059d"}
