{"artifact_epoch":0,"build_receipt_id":"51b4b28528b73db86aabd06066b36c4331f15755613245f41f63ac2173dbf4b2","canonicalization":"rs-canonical-json-v1","computation_ms":107,"coverage_plan_digest":"8a26a8c7926ae393aaa33d2d6a1bfc80f4d9a5e9f7b685c81779a7816d1ee930","entries":[{"component_digest_version":"validation-entry-components.v1","component_digests":{"arguments":"3febd6abf2e5e40a3ac64d94bac3052f1f54910c23add8cd79e933c05d3bd6c4","artifact_epoch":"5feceb66ffc86f38d952786c6d696c79c2dbc239dd4e91b46729d73a27fb57e9","build_artifact":"94a58bc559b12057f3c09cc08449b701b6b9ab6de678c4d14cf52508cb18098a","capability":"82aeaf435d9c070a4811da610c97957924dfff56c19ae035ccf278f3aabba559","coverage":"f6790ad71716931d7c40bfa99374de13ccf1631f8378ac75b65e714705e77f29","environment":"8b7d00b0c7aac7907e16b1cf899542043d74cd6174b43e4740046627ab79b691","logical_input":"73fba6f59ae9a3061cc88d00af8f665d2839c86a89b5488e0909d134936ed481","outcome_policy":"2e35f04f0ac921c2ef182cc59b5d7c26a0b8986b516af91cc5a72c65a5ae6a14","runner":"d1c7ce2c721582b79031bfb54411db782e90860e9c15c3443106c03863825f6f","shared_contract":"bf221cda7633cc1d2fcdb1b8453928cc93bbb9ba9bb591f2860ea506f8f5e38c","source_input":"25e3a5a49a91ab61aa33ee63d933bf5b830b13132abfe4d6cf227008c6dc2148"},"computation_ms":70,"fingerprint":"65b1e54c95b822e60cbf5e7ae5b9a0c27c478a6d471e7d9527721645375ea3c0","id":"selftest.file-operations"}],"fingerprints_digest":"9aaa787b1d30533abef6c5cfe205d458c890fa89b8a4fb9a98b60a975b4f983d","plan_digest":"995f7428102488c2d67e7d15de1e8e605bd9bce511fa950425014363a6fcdc8b","schema":"red-salamander.validation-entry-fingerprints.v1","snapshot_id":"54236672731926baacdec359ba23952099e93c4b536d822fc11f7e0d09dd15de"}
