{"artifact_epoch":0,"build_receipt_id":"06203c1748576f7b6f57bc3bd52d50dec3e78b1131180b5eed9cddd187ecff1d","canonicalization":"rs-canonical-json-v1","computation_ms":114,"coverage_plan_digest":"8a26a8c7926ae393aaa33d2d6a1bfc80f4d9a5e9f7b685c81779a7816d1ee930","entries":[{"component_digest_version":"validation-entry-components.v1","component_digests":{"arguments":"3febd6abf2e5e40a3ac64d94bac3052f1f54910c23add8cd79e933c05d3bd6c4","artifact_epoch":"5feceb66ffc86f38d952786c6d696c79c2dbc239dd4e91b46729d73a27fb57e9","build_artifact":"55abfb5daf11ccb5f36b9726be29ed85f2bd92e1b24ff4c098fd3d8c61ca1fc8","capability":"82aeaf435d9c070a4811da610c97957924dfff56c19ae035ccf278f3aabba559","coverage":"f6790ad71716931d7c40bfa99374de13ccf1631f8378ac75b65e714705e77f29","environment":"8b7d00b0c7aac7907e16b1cf899542043d74cd6174b43e4740046627ab79b691","logical_input":"f4af52345ef300d46533f26989424836fa414cb2d842475e708dc587150fb01e","outcome_policy":"2e35f04f0ac921c2ef182cc59b5d7c26a0b8986b516af91cc5a72c65a5ae6a14","runner":"d1c7ce2c721582b79031bfb54411db782e90860e9c15c3443106c03863825f6f","shared_contract":"bf221cda7633cc1d2fcdb1b8453928cc93bbb9ba9bb591f2860ea506f8f5e38c","source_input":"58f27b81ff3b6aac59dfc48251cf7f79bc68b2e5dc51bb335f54083dbf0a16a2"},"computation_ms":81,"fingerprint":"c30782566526bb5421ce568f586ccaec320ad6c9890a081fa8579e045b732b52","id":"selftest.file-operations"}],"fingerprints_digest":"e91f42e09f0d7b25bcc887f8273ac266fdc4b9c644e12d2f875ca8a8639e7e73","plan_digest":"995f7428102488c2d67e7d15de1e8e605bd9bce511fa950425014363a6fcdc8b","schema":"red-salamander.validation-entry-fingerprints.v1","snapshot_id":"673426f0da99bcb2f72a90557ff98fa35f8d7574212dc5fbf31bbae243ac4530"}
